{
  "$schema": "https://json-schema.org/draft/2020-12/schema",
  "title": "Diet Assistant プロフィール",
  "description": "config/profile.json の形式。すべての項目が任意で、ファイル自体が無くてもCLIは動作する。",
  "type": "object",
  "additionalProperties": false,
  "properties": {
    "$schema": {
      "type": "string",
      "description": "エディタ補完用のスキーマ参照。検証では無視する。"
    },
    "height_cm": {
      "type": "number",
      "minimum": 100,
      "maximum": 250,
      "description": "身長（cm）。暫定維持カロリーの計算に使う。"
    },
    "birth_date": {
      "type": "string",
      "format": "date",
      "description": "生年月日（YYYY-MM-DD）。暫定維持カロリーの計算に使う。"
    },
    "sex": {
      "type": "string",
      "enum": ["female", "male", "unspecified"],
      "description": "暫定維持カロリーの計算に使う。unspecifiedの場合は計算しない。"
    },
    "activity_level": {
      "type": "string",
      "enum": ["sedentary", "light", "moderate", "active", "very_active"],
      "description": "日常の活動量。暫定維持カロリーの活動係数に使う。"
    },
    "timezone": {
      "type": "string",
      "description": "IANAタイムゾーン名。現在コードからは参照せず、OSのタイムゾーンを使う。将来用。"
    },
    "day_start_time": {
      "type": "string",
      "pattern": "^([01]\\d|2[0-3]):[0-5]\\d$",
      "description": "記録上の一日の開始時刻（HH:MM）。日次・週次レポートとフィードバックの集計境界に使う。未設定なら00:00。"
    },
    "dietary_restrictions": {
      "type": "array",
      "items": { "type": "string" },
      "description": "食事制限。例: [\"低塩\", \"乳製品を控える\"]"
    },
    "allergies": {
      "type": "array",
      "items": { "type": "string" },
      "description": "アレルギー。例: [\"そば\", \"えび\"]"
    },
    "meals_per_day": {
      "type": "integer",
      "minimum": 1,
      "maximum": 10,
      "description": "1日の食事回数の目安。"
    },
    "feedback_preference": {
      "type": "string",
      "description": "フィードバックの方針。エージェントが読む自由記述。"
    },
    "routine": {
      "type": "array",
      "items": {
        "type": "string",
        "enum": ["weight", "breakfast", "lunch", "snack", "dinner", "exercise", "report"]
      },
      "description": "1日のルーティーンを実施順で並べたもの。時刻ではなく順序で管理する。エージェントが記録の依頼を受けたとき、先行ステップの記録抜けを確認するために読む。コードからは参照しない。"
    },
    "photo_retention_days": {
      "type": "integer",
      "minimum": 1,
      "description": "diet photo cleanup の既定保持日数。未設定なら30。"
    }
  }
}
