{
  "height_cm": 170,
  "birth_date": "1990-01-01",
  "sex": "unspecified",
  "activity_level": "moderate",
  "timezone": "Asia/Tokyo",
  "day_start_time": "04:00",
  "dietary_restrictions": [],
  "allergies": [],
  "meals_per_day": 3,
  "feedback_preference": "小さく継続可能な変更を優先",
  "routine": ["weight", "breakfast", "lunch", "snack", "dinner", "report"],
  "photo_retention_days": 30
}
